dbGaP_accession_num,web_address,study_name,disease_name
phs000744.v4.p2,http://www.ncbi.nlm.nih.gov/projects/gap/cgi-bin/study.cgi?study_id=phs000744.v4.p2,Yale Center for Mendelian Genomics (Y CMG),Familial Idiopathic Pulmonary Fibrosis
phs000693.v4.p1,http://www.ncbi.nlm.nih.gov/projects/gap/cgi-bin/study.cgi?study_id=phs000693.v4.p1,University of Washington Center for Mendelian Genomics (UW-CMG),Rare Diseases
phs000467.v12.p5,http://www.ncbi.nlm.nih.gov/projects/gap/cgi-bin/study.cgi?study_id=phs000467.v12.p5,TARGET: Neuroblastoma (NBL),Neuroblastoma
phs000218.v15.p5,http://www.ncbi.nlm.nih.gov/projects/gap/cgi-bin/study.cgi?study_id=phs000218.v15.p5,NCI TARGET: Therapeutically Applicable Research to Generate Effective Treatments,Neoplasms
phs000868.v1.p1,http://www.ncbi.nlm.nih.gov/projects/gap/cgi-bin/study.cgi?study_id=phs000868.v1.p1,Transcriptome Sequencing of Pediatric Neuroblastoma,Neuroblastoma
